QuestionNumber,QuestionText,ResultRank1,ResultRank2,ResultRank3,ResultRank4,ResultRank5,ResultRank6,ResultRank7,ResultRank8,ResultRank9,ResultRank10
1,what could be leaving these little black pellets all over my cucumbers? Some terminal new growth is wilted.,Cucumber...                       (URL: http://ipm.ucanr.edu/home-and-landscape/cucumber/index.html?src=exchbt),Squash Bugs...                    (URL: http://ipm.ucanr.edu/PMG/PESTNOTES/pn74144.html?src=exchbt),Pea virus diseases...             (URL: http://ipm.ucanr.edu/PMG/GARDEN/VEGES/DISEASES/peavirusdis.html?src=exchbt),Verticillium wilt on cucurbits... (URL: http://ipm.ucanr.edu/PMG/GARDEN/VEGES/DISEASES/cuverticwilt.html?src=exchbt),Phytophthora root rot on cole ... (URL: http://ipm.ucanr.edu/PMG/GARDEN/VEGES/DISEASES/phytophtora.html?src=exchbt),White mold...                     (URL: http://ipm.ucanr.edu/PMG/GARDEN/VEGES/DISEASES/whitemoldlet.html?src=exchbt),Phytophthora root and crown ro... (URL: http://ipm.ucanr.edu/PMG/GARDEN/FRUIT/DISEASE/phytoprot.html?src=exchbt),Wild cucumber...                  (URL: http://ipm.ucanr.edu/PMG/WEEDS/wild_cucumber.html?src=exchbt),Harvesting and storing figs...    (URL: http://ipm.ucanr.edu/PMG/GARDEN/FRUIT/CULTURAL/figsharvesting.html?src=exchbt),Mealybugs...                      (URL: http://ipm.ucanr.edu/PMG/PESTNOTES/pn74174.html?src=exchbt)
2,"I have a black mold looking fungus growing on my apple trees where I pruned them last year. Wondering what it is, how I can prevent it next time I prune the trees, and how to treat it now.",Pruning your tomatoes...          (URL: http://ipm.ucanr.edu/PMG/GARDEN/VEGES/CULTURAL/tompruning.html?src=exchbt),Pruning your tomatoes...          (URL: http://ipm.ucanr.edu/PMG/GARDEN/VEGES/ENVIRON/tompruning.html?src=exchbt),Cypress canker...                 (URL: http://ipm.ucanr.edu/PMG/GARDEN/PLANTS/DISEASES/cyprcanker.html?src=exchbt),Sanitation...                     (URL: http://ipm.ucanr.edu/PMG/GARDEN/FRUIT/CULTURAL/sanitation.html?src=exchbt),Powdery Mildew on Fruits and B... (URL: http://ipm.ucanr.edu/PMG/PESTNOTES/pn7494.html?src=exchbt),"Botrytis blight, or gray mold...  (URL: http://ipm.ucanr.edu/PMG/GARDEN/PLANTS/DISEASES/botrytis.html?src=exchbt)",Roses: Diseases and Abiotic Di... (URL: http://ipm.ucanr.edu/PMG/PESTNOTES/pn7463.html?src=exchbt),Dutch elm disease...              (URL: http://ipm.ucanr.edu/PMG/GARDEN/PLANTS/DISEASES/dutchelmdis.html?src=exchbt),Sycamore canker stain...          (URL: http://ipm.ucanr.edu/PMG/GARDEN/PLANTS/DISEASES/cankerstain.html?src=exchbt),Eutypa dieback...                 (URL: http://ipm.ucanr.edu/PMG/GARDEN/FRUIT/DISEASE/eutypadiebk.html?src=exchbt)
5,"I have three Douglas Fir trees in my yard which produce lots of debris. Could I use them as a mulch for my blueberries, rhodies and azaleas?",Weed management around fruit a... (URL: http://ipm.ucanr.edu/PMG/GARDEN/FRUIT/WEEDS/frtweedmgt.html?src=exchbt),"Cedar, cypress, and juniper ru... (URL: http://ipm.ucanr.edu/PMG/GARDEN/PLANTS/DISEASES/cedcyrust.html?src=exchbt)",Earwigs...                        (URL: http://ipm.ucanr.edu/PMG/PESTNOTES/pn74102.html?src=exchbt),Mulch and the spread of plant ... (URL: http://ipm.ucanr.edu/PMG/GARDEN/ENVIRON/mulchpath.html?src=exchbt),Mulches...                        (URL: http://ipm.ucanr.edu/PMG/GARDEN/FRUIT/ENVIRON/mulches.html?src=exchbt),Leafrollers on Ornamental and ... (URL: http://ipm.ucanr.edu/PMG/PESTNOTES/pn7473.html?src=exchbt),Wood Decay Fungi in Landscape ... (URL: http://ipm.ucanr.edu/PMG/PESTNOTES/pn74109.html?src=exchbt),Azalea petal blight and rhodod... (URL: http://ipm.ucanr.edu/PMG/GARDEN/PLANTS/DISEASES/flowerblight.html?src=exchbt),Holly...                          (URL: http://ipm.ucanr.edu/PMG/GARDEN/PLANTS/holly.html?src=exchbt),Mulches vary in their benefits... (URL: http://ipm.ucanr.edu/PMG/GARDEN/ENVIRON/mulchtbl.html?src=exchbt)
11,"I have been finding tiny bugs on my floors, mostly in the kitchen. They are I think 6-legged, backs with yellowish spots/stripes on black. Heads smaller than bodies, and maybe 1/2 by 1 millimeter size. I think they may be able to fly, but not sure.",True bugs...                      (URL: http://ipm.ucanr.edu/PMG/GARDEN/PLANTS/INVERT/truebugs.html?src=exchbt),Stink bugs...                     (URL: http://ipm.ucanr.edu/PMG/GARDEN/VEGES/PESTS/stinkbug.html?src=exchbt),Wood Wasps and Horntails...       (URL: http://ipm.ucanr.edu/PMG/PESTNOTES/pn7407.html?src=exchbt),Leaffooted Bug...                 (URL: http://ipm.ucanr.edu/PMG/PESTNOTES/pn74168.html?src=exchbt),Bagrada Bug...                    (URL: http://ipm.ucanr.edu/PMG/PESTNOTES/pn74166.html?src=exchbt),Cockroaches...                    (URL: http://ipm.ucanr.edu/PMG/PESTNOTES/pn7467.html?src=exchbt),Bed Bugs...                       (URL: http://ipm.ucanr.edu/PMG/PESTNOTES/pn7454.html?src=exchbt),Chinch and false chinch bugs...   (URL: http://ipm.ucanr.edu/PMG/GARDEN/PLANTS/INVERT/chinchbug.html?src=exchbt),Clothes Moths...                  (URL: http://ipm.ucanr.edu/PMG/PESTNOTES/pn7435.html?src=exchbt),Fiery skipper...                  (URL: http://ipm.ucanr.edu/TOOLS/TURF/PESTS/inskipper.html?src=exchbt)
20,"We had a new elk herd in our area last year. They managed to eat all of the fruit off the trees, plus damaging the trees. They enjoyed many items from our garden, especially the corn and sunflowers and went on to trample low growing things before moving on to the squash, etc. Any suggestions for detouring the elk?",Deer...                           (URL: http://ipm.ucanr.edu/PMG/PESTNOTES/pn74117.html?src=exchbt),Poison Oak...                     (URL: http://ipm.ucanr.edu/PMG/PESTNOTES/pn7431.html?src=exchbt),Wild Pigs...                      (URL: http://ipm.ucanr.edu/PMG/PESTNOTES/pn74170.html?src=exchbt),Woody Weed Invaders...            (URL: http://ipm.ucanr.edu/PMG/PESTNOTES/pn74142.html?src=exchbt),Snails and Slugs...               (URL: http://ipm.ucanr.edu/PMG/PESTNOTES/pn7427.html?src=exchbt),Rabbits...                        (URL: http://ipm.ucanr.edu/PMG/PESTNOTES/pn7447.html?src=exchbt),Deer Mouse...                     (URL: http://ipm.ucanr.edu/PMG/PESTNOTES/pn74161.html?src=exchbt),Goldspotted Oak Borer...          (URL: http://ipm.ucanr.edu/PMG/PESTNOTES/pn74163.html?src=exchbt),Orchardgrass...                   (URL: http://ipm.ucanr.edu/PMG/WEEDS/orchardgrass.html?src=exchbt),Coyote...                         (URL: http://ipm.ucanr.edu/PMG/PESTNOTES/pn74135.html?src=exchbt)
28,I have Japanese knotweed in my garden. We have tried digging them and burning them.,Common knotweed (prostrate kno... (URL: http://ipm.ucanr.edu/PMG/WEEDS/common_knotweed.html?src=exchbt),Common Knotweed...                (URL: http://ipm.ucanr.edu/PMG/PESTNOTES/pn7484.html?src=exchbt),Knotgrass...                      (URL: http://ipm.ucanr.edu/PMG/WEEDS/knotgrass.html?src=exchbt),Perennial Pepperweed...           (URL: http://ipm.ucanr.edu/PMG/PESTNOTES/pn74121.html?src=exchbt),Field Bindweed...                 (URL: http://ipm.ucanr.edu/PMG/PESTNOTES/pn7462.html?src=exchbt),Russian knapweed...               (URL: http://ipm.ucanr.edu/PMG/WEEDS/russian_knapweed.html?src=exchbt),Mulch and the spread of plant ... (URL: http://ipm.ucanr.edu/PMG/GARDEN/ENVIRON/mulchpath.html?src=exchbt),Jimsonweed...                     (URL: http://ipm.ucanr.edu/PMG/WEEDS/jimsonweed.html?src=exchbt),Burning nettle...                 (URL: http://ipm.ucanr.edu/PMG/WEEDS/burning_nettle.html?src=exchbt),Russian Thistle...                (URL: http://ipm.ucanr.edu/PMG/PESTNOTES/pn7486.html?src=exchbt)
