QuestionNumber,QuestionText,ResultRank1,ResultRank2,ResultRank3,ResultRank4,ResultRank5,ResultRank6,ResultRank7,ResultRank8,ResultRank9,ResultRank10
1,"my Night Queen plants have developed brown spots on the leaves and around the edges on some of the leaves. I have followed the advice on watering, light, soil etc. Also tried putting cinnamon on the affected leaves but to no avail. Should I be cutting off the affected leaves or just leave them alone? The plant is very healthy apart from the little brown spots.",Potassium deficiency...           (URL: http://ipm.ucanr.edu/PMG/GARDEN/PLANTS/DISORDERS/potassiumdeficiency.html?src=exchbt),Powdery mildew on peas and bea... (URL: http://ipm.ucanr.edu/PMG/GARDEN/VEGES/DISEASES/peapowdermildew.html?src=exchbt),Squash bug...                     (URL: http://ipm.ucanr.edu/PMG/GARDEN/VEGES/PESTS/squashbug.html?src=exchbt),Scab...                           (URL: http://ipm.ucanr.edu/PMG/GARDEN/PLANTS/DISEASES/scab.html?src=exchbt),Botrytis leafspot (leaf blight... (URL: http://ipm.ucanr.edu/PMG/GARDEN/VEGES/DISEASES/botryslfspot.html?src=exchbt),Noninfectious plum shothole...    (URL: http://ipm.ucanr.edu/PMG/GARDEN/FRUIT/ENVIRON/noninfectplmsht.html?src=exchbt),Verticillium wilt on peppers a... (URL: http://ipm.ucanr.edu/PMG/GARDEN/VEGES/DISEASES/pepvertwilt.html?src=exchbt),Powdery mildew on lettuce...      (URL: http://ipm.ucanr.edu/PMG/GARDEN/VEGES/DISEASES/letpowderymil.html?src=exchbt),Tipburn on lettuce and spinach... (URL: http://ipm.ucanr.edu/PMG/GARDEN/VEGES/ENVIRON/lettipburn.html?src=exchbt),Iron deficiency...                (URL: http://ipm.ucanr.edu/PMG/GARDEN/PLANTS/DISORDERS/irondeficiency.html?src=exchbt)
2,We have an almond tree that is producing almonds. Come to find out the almonds are full of worms. Can you help with a what type of worm it is and possibly a plan of action?,Fertilizing almonds...            (URL: http://ipm.ucanr.edu/PMG/GARDEN/FRUIT/CULTURAL/fertilizing.html?src=exchbt),Almonds...                        (URL: http://ipm.ucanr.edu/PMG/GARDEN/FRUIT/almonds.html?src=exchbt),Walnut Husk Fly...                (URL: http://ipm.ucanr.edu/PMG/PESTNOTES/pn7430.html?src=exchbt),Horsehair Worms...                (URL: http://ipm.ucanr.edu/PMG/PESTNOTES/pn7471.html?src=exchbt),Fertilizing walnuts...            (URL: http://ipm.ucanr.edu/PMG/GARDEN/FRUIT/ENVIRON/depbrkcanfert.html?src=exchbt),Codling Moth...                   (URL: http://ipm.ucanr.edu/PMG/PESTNOTES/pn7412.html?src=exchbt),Harvesting and storing almonds... (URL: http://ipm.ucanr.edu/PMG/GARDEN/FRUIT/CULTURAL/almondharvest.html?src=exchbt),Blackline of walnuts...           (URL: http://ipm.ucanr.edu/PMG/GARDEN/FRUIT/DISEASE/walblackline.html?src=exchbt),Brown mite...                     (URL: http://ipm.ucanr.edu/PMG/GARDEN/FRUIT/PESTS/avbrownmite.html?src=exchbt),Site selection Almonds and Wal... (URL: http://ipm.ucanr.edu/PMG/GARDEN/FRUIT/CULTURAL/almondsite.html?src=exchbt)
3,"My coreopsis plants are being eaten by bugs similar to lady and bugs, but a bit different. Did not have this problem last year. Do you know what they are and what I might do about them? Thanks",Conenose Bugs...                  (URL: http://ipm.ucanr.edu/PMG/PESTNOTES/pn7455.html?src=exchbt),Lygus bugs...                     (URL: http://ipm.ucanr.edu/PMG/GARDEN/VEGES/PESTS/lygusbugs.html?src=exchbt),Stink bugs...                     (URL: http://ipm.ucanr.edu/PMG/GARDEN/VEGES/PESTS/stinkbug.html?src=exchbt),Azadirachtin - insecticide (bo... (URL: http://ipm.ucanr.edu/TOOLS/PNAI/pnaishow.php?id=8?src=exchbt),Squash Bugs...                    (URL: http://ipm.ucanr.edu/PMG/PESTNOTES/pn74144.html?src=exchbt),Leaffooted Bug...                 (URL: http://ipm.ucanr.edu/PMG/PESTNOTES/pn74168.html?src=exchbt),Pyrethrin - insecticide (botan... (URL: http://ipm.ucanr.edu/TOOLS/PNAI/pnaishow.php?id=62?src=exchbt),True bugs...                      (URL: http://ipm.ucanr.edu/PMG/GARDEN/PLANTS/INVERT/truebugs.html?src=exchbt),"Soap - fungicide, insecticide,... (URL: http://ipm.ucanr.edu/TOOLS/PNAI/pnaishow.php?id=43?src=exchbt)",False Chinch Bug...               (URL: http://ipm.ucanr.edu/PMG/PESTNOTES//pn74153.html?src=exchbt)
4,"Anyone know what this is on our bushes? Looks like a cocoon, but there are a lot of cotton looking like things and bugs all over the vine.",Lygus bugs...                     (URL: http://ipm.ucanr.edu/PMG/GARDEN/VEGES/PESTS/lygusbugs.html?src=exchbt),Conenose Bugs...                  (URL: http://ipm.ucanr.edu/PMG/PESTNOTES/pn7455.html?src=exchbt),Stink bugs...                     (URL: http://ipm.ucanr.edu/PMG/GARDEN/VEGES/PESTS/stinkbug.html?src=exchbt),Acephate - insecticide (organo... (URL: http://ipm.ucanr.edu/TOOLS/PNAI/pnaishow.php?id=5?src=exchbt),Common causes of plant galls...   (URL: http://ipm.ucanr.edu/PMG/GARDEN/PLANTS/INVERT/comcaugalls.html?src=exchbt),Earwigs...                        (URL: http://ipm.ucanr.edu/PMG/PESTNOTES/pn74102.html?src=exchbt),Cotton on bushes?...              (URL: https://ask2.extension.org/kb/faq.php?id=137060),Spider Mites...                   (URL: http://ipm.ucanr.edu/PMG/PESTNOTES/pn7405.html?src=exchbt),Lace Bugs...                      (URL: http://ipm.ucanr.edu/PMG/PESTNOTES/pn7428.html?src=exchbt),Squash Bugs...                    (URL: http://ipm.ucanr.edu/PMG/PESTNOTES/pn74144.html?src=exchbt)
5,"There are some fast moving tiny bugs in my kitchen, bathroom and I found them in the living room now. Sometimes they are black, some light brown and some kinda white. I saw springtail online, but I don't think the one I have jumps. They are tiny like coffee grind, and when it moves, it moves fast.",Brown Marmorated Stink Bug...     (URL: http://ipm.ucanr.edu/PMG/PESTNOTES/pn74169.html?src=exchbt),Black spot...                     (URL: http://ipm.ucanr.edu/PMG/GARDEN/PLANTS/DISEASES/blackspot.html?src=exchbt),Fast tiny bug....                 (URL: https://ask2.extension.org/kb/faq.php?id=367191),White mold...                     (URL: http://ipm.ucanr.edu/PMG/GARDEN/VEGES/DISEASES/whitemoldlet.html?src=exchbt),White mold...                     (URL: http://ipm.ucanr.edu/PMG/GARDEN/VEGES/DISEASES/whitemold.html?src=exchbt),White mold...                     (URL: http://ipm.ucanr.edu/PMG/GARDEN/VEGES/DISEASES/tomwhmold.html?src=exchbt),Pea weevil...                     (URL: http://ipm.ucanr.edu/PMG/GARDEN/VEGES/PESTS/peaweevil.html?src=exchbt),Pepper weevil...                  (URL: http://ipm.ucanr.edu/PMG/GARDEN/VEGES/PESTS/pepperweevil.html?src=exchbt),Oriental fruit moth...            (URL: http://ipm.ucanr.edu/PMG/GARDEN/FRUIT/PESTS/orientfrmoth.html?src=exchbt),Onion maggot...                   (URL: http://ipm.ucanr.edu/PMG/GARDEN/VEGES/PESTS/onionmaggot.html?src=exchbt)
6,"I have had weevil infestation in my pantry which I discarded its source. However, they are spread across the house and i could see some of them stick to the outer side of milk carton which are placed inside my bedroom. I dont know if the milk is safe to consume as even if I dont see adult weevil, they might have laid eggs which cannot be seen by naked eyes.",Gran Weevils attached to milk ... (URL: https://ask2.extension.org/kb/faq.php?id=541334),Silverfish and Firebrats...       (URL: http://ipm.ucanr.edu/PMG/PESTNOTES/pn7475.html?src=exchbt),Bed Bugs...                       (URL: http://ipm.ucanr.edu/PMG/PESTNOTES/pn7454.html?src=exchbt),Carpet Beetles...                 (URL: http://ipm.ucanr.edu/PMG/PESTNOTES/pn7436.html?src=exchbt),Widow Spiders and Their Relati... (URL: http://ipm.ucanr.edu/PMG/PESTNOTES/pn74149.html?src=exchbt),Centipedes and Millipedes...      (URL: http://ipm.ucanr.edu/PMG/PESTNOTES/pn7472.html?src=exchbt),Spider Mites...                   (URL: http://ipm.ucanr.edu/PMG/PESTNOTES/pn7405.html?src=exchbt),Pantry Pests...                   (URL: http://ipm.ucanr.edu/PMG/PESTNOTES/pn7452.html?src=exchbt),Delusory Parasitosis...           (URL: http://ipm.ucanr.edu/PMG/PESTNOTES/pn7443.html?src=exchbt),Clothes Moths...                  (URL: http://ipm.ucanr.edu/PMG/PESTNOTES/pn7435.html?src=exchbt)
7,"My milkweed have already bloomed, but now there are strange ""caterpillars"" on the leaves. They are about 3/4 inch long, have black bodies with orange either on the top or bottom.  The insects are fuzzy and I think they are eating the leaves.  Should I try to kill them and if so, how?",Roses: Insects and Mites...       (URL: http://ipm.ucanr.edu/PMG/PESTNOTES/pn7466.html?src=exchbt),Sphinx moths...                   (URL: http://ipm.ucanr.edu/PMG/GARDEN/FRUIT/PESTS/spinxmoths.html?src=exchbt),Redhumped Caterpillar...          (URL: http://ipm.ucanr.edu/PMG/PESTNOTES/pn7474.html?src=exchbt),Common causes of plant galls...   (URL: http://ipm.ucanr.edu/PMG/GARDEN/PLANTS/INVERT/comcaugalls.html?src=exchbt),Boxwood leafminer...              (URL: http://ipm.ucanr.edu/PMG/GARDEN/PLANTS/INVERT/boxwoodlfmin.html?src=exchbt),Lawn Insects...                   (URL: http://ipm.ucanr.edu/PMG/PESTNOTES/pn7476.html?src=exchbt),Ash leafcurl aphid...             (URL: http://ipm.ucanr.edu/PMG/GARDEN/PLANTS/INVERT/ashlfaph.html?src=exchbt),Imported cabbageworm...           (URL: http://ipm.ucanr.edu/PMG/GARDEN/VEGES/PESTS/importcabwrm.html?src=exchbt),Orange tortrix...                 (URL: http://ipm.ucanr.edu/PMG/GARDEN/FRUIT/PESTS/orangetortix.html?src=exchbt),Aphids...                         (URL: http://ipm.ucanr.edu/PMG/PESTNOTES/pn7404.html?src=exchbt)
8,"I have a black mold looking fungus growing on my apple trees where I pruned them last year. Wondering what it is, how I can prevent it next time I prune the trees, and how to treat it now.",Black mold on tomato...           (URL: http://ipm.ucanr.edu/PMG/GARDEN/VEGES/DISEASES/tomblkmold.html?src=exchbt),Wood Decay Fungi in Landscape ... (URL: http://ipm.ucanr.edu/PMG/PESTNOTES/pn74109.html?src=exchbt),Sunscald on tomatoes...           (URL: http://ipm.ucanr.edu/PMG/GARDEN/VEGES/ENVIRON/tomsunscald.html?src=exchbt),Black root rot of strawberries... (URL: http://ipm.ucanr.edu/PMG/GARDEN/FRUIT/DISEASE/strblkrot.html?src=exchbt),Black mold on onions and garli... (URL: http://ipm.ucanr.edu/PMG/GARDEN/VEGES/DISEASES/onblackmold.html?src=exchbt),Armillaria Root Rot...            (URL: http://ipm.ucanr.edu/PMG/PESTNOTES/pn74171.html?src=exchbt),Botrytis rot (Gray mold) on ar... (URL: http://ipm.ucanr.edu/PMG/GARDEN/VEGES/DISEASES/artigraymold.html?src=exchbt),Black nightshade...               (URL: http://ipm.ucanr.edu/PMG/WEEDS/black_nightshade.html?src=exchbt),White mold...                     (URL: http://ipm.ucanr.edu/PMG/GARDEN/VEGES/DISEASES/tomwhmold.html?src=exchbt),No answer
9,Does Orthene Systemic insecticide work to control Japanese beetles?,"Leaf beetles, cucumber beetles... (URL: http://ipm.ucanr.edu/PMG/GARDEN/FLOWERS/INVERT/leafbeet.html?src=exchbt)",Spinosad - insecticide...         (URL: http://ipm.ucanr.edu/TOOLS/PNAI/pnaishow.php?id=65?src=exchbt),Permethrin - insecticide (pyre... (URL: http://ipm.ucanr.edu/TOOLS/PNAI/pnaishow.php?id=59?src=exchbt),Hoplia Beetle...                  (URL: http://ipm.ucanr.edu/PMG/PESTNOTES/pn7499.html?src=exchbt),Pest identification and confir... (URL: http://ipm.ucanr.edu/PMG/GARDEN/PLANTS/INVERT/cmnleafbeetle.html?src=exchbt),Imidacloprid - insecticide (ne... (URL: http://ipm.ucanr.edu/TOOLS/PNAI/pnaishow.php?id=42?src=exchbt),Elm Leaf Beetle...                (URL: http://ipm.ucanr.edu/PMG/PESTNOTES/pn7403.html?src=exchbt),Carbaryl - insecticide (carbam... (URL: http://ipm.ucanr.edu/TOOLS/PNAI/pnaishow.php?id=20?src=exchbt),Roses: Insects and Mites...       (URL: http://ipm.ucanr.edu/PMG/PESTNOTES/pn7466.html?src=exchbt),Acephate - insecticide (organo... (URL: http://ipm.ucanr.edu/TOOLS/PNAI/pnaishow.php?id=5?src=exchbt)
10,"I'm interested in finding a local source for vegetable plants that are a little unusual, and native flower sources. Is there a list or catalog of native or friendly plant growers?",Invasive Plants...                (URL: http://ipm.ucanr.edu/PMG/PESTNOTES/pn74139.html?src=exchbt),Linden...                         (URL: http://ipm.ucanr.edu/PMG/GARDEN/PLANTS/linden.html?src=exchbt),Gardenia (Cape jasmine)...        (URL: http://ipm.ucanr.edu/PMG/GARDEN/PLANTS/gardenia.html?src=exchbt),No answer,No answer,No answer,No answer,No answer,No answer,No answer
11,"I have three Douglas Fir trees in my yard which produce lots of debris. Could I use them as a mulch for my blueberries, rhodies and azaleas?",Pepper tree (California pepper... (URL: http://ipm.ucanr.edu/PMG/GARDEN/PLANTS/peppertree.html?src=exchbt),Carpenterworm...                  (URL: http://ipm.ucanr.edu/PMG/PESTNOTES/pn74105.html?src=exchbt),Oak...                            (URL: http://ipm.ucanr.edu/PMG/GARDEN/PLANTS/oak.html?src=exchbt),Pine...                           (URL: http://ipm.ucanr.edu/PMG/GARDEN/PLANTS/pine.html?src=exchbt),California Oakworm...             (URL: http://ipm.ucanr.edu/PMG/PESTNOTES/pn7422.html?src=exchbt),Persimmon...                      (URL: http://ipm.ucanr.edu/PMG/GARDEN/PLANTS/persimmon.html?src=exchbt),Rose...                           (URL: http://ipm.ucanr.edu/PMG/GARDEN/PLANTS/rose.html?src=exchbt),"Maidenhair tree, Ginkgo...        (URL: http://ipm.ucanr.edu/PMG/GARDEN/PLANTS/maidenhair.html?src=exchbt)",Ground Squirrel...                (URL: http://ipm.ucanr.edu/PMG/PESTNOTES/pn7438.html?src=exchbt),Pruning apricot trees...          (URL: http://ipm.ucanr.edu/PMG/GARDEN/FRUIT/CULTURAL/apripruning.html?src=exchbt)
12,"I'm looking for a planting guide on current weather conditions, forecast temperature in air and soil for guidance on a up to date format. I'm attempting to plant a vegetable market garden.",Planting...                       (URL: http://ipm.ucanr.edu/PMG/GARDEN/FRUIT/ENVIRON/strawplanting.html?src=exchbt),Planting...                       (URL: http://ipm.ucanr.edu/PMG/GARDEN/FRUIT/ENVIRON/graplant.html?src=exchbt),Planting...                       (URL: http://ipm.ucanr.edu/PMG/GARDEN/FRUIT/ENVIRON/fruitnutplanting.html?src=exchbt),Planting...                       (URL: http://ipm.ucanr.edu/PMG/GARDEN/VEGES/ENVIRON/planting.html?src=exchbt),Planting...                       (URL: http://ipm.ucanr.edu/PMG/GARDEN/VEGES/ENVIRON/carrotplanting.html?src=exchbt),Planting...                       (URL: http://ipm.ucanr.edu/PMG/GARDEN/FRUIT/ENVIRON/avoplanting.html?src=exchbt),Planting...                       (URL: http://ipm.ucanr.edu/PMG/GARDEN/VEGES/ENVIRON/crnplanting.html?src=exchbt),Planting...                       (URL: http://ipm.ucanr.edu/PMG/GARDEN/VEGES/ENVIRON/potplanting.html?src=exchbt),Plant properly...                 (URL: http://ipm.ucanr.edu/PMG/GARDEN/ENVIRON/plantproperly.html?src=exchbt),Common environmental disorders... (URL: http://ipm.ucanr.edu/PMG/GARDEN/VEGES/ENVIRON/commonprob.html?src=exchbt)
14,We would like to prepare the soil for a vegetable garden. What is the best way to prepare the soil?,Eggplant...                       (URL: http://ipm.ucanr.edu/home-and-landscape/eggplant/index.html?src=exchbt),Squash...                         (URL: http://ipm.ucanr.edu/home-and-landscape/squash/index.html?src=exchbt),Cabbage...                        (URL: http://ipm.ucanr.edu/home-and-landscape/cabbage/index.html?src=exchbt),Lettuce...                        (URL: http://ipm.ucanr.edu/home-and-landscape/lettuce/index.html?src=exchbt),Chard...                          (URL: http://ipm.ucanr.edu/home-and-landscape/chard/index.html?src=exchbt),Tomato...                         (URL: http://ipm.ucanr.edu/home-and-landscape/tomato/index.html?src=exchbt),Spinach...                        (URL: http://ipm.ucanr.edu/home-and-landscape/spinach/index.html?src=exchbt),Soil preparation...               (URL: http://ipm.ucanr.edu/PMG/GARDEN/VEGES/ENVIRON/soilprep.html?src=exchbt),Carrot...                         (URL: http://ipm.ucanr.edu/home-and-landscape/carrot/index.html?src=exchbt),Pumpkins...                       (URL: http://ipm.ucanr.edu/home-and-landscape/pumpkins/index.html?src=exchbt)
16,What are the recommended sprays to use on apple and cherry trees?,Pruning cherry trees...           (URL: http://ipm.ucanr.edu/PMG/GARDEN/FRUIT/CULTURAL/cherpruning.html?src=exchbt),Pruning apple and pear trees...   (URL: http://ipm.ucanr.edu/PMG/GARDEN/FRUIT/CULTURAL/applepruning.html?src=exchbt),Scab...                           (URL: http://ipm.ucanr.edu/PMG/GARDEN/PLANTS/DISEASES/scab.html?src=exchbt),Pruning apricot trees...          (URL: http://ipm.ucanr.edu/PMG/GARDEN/FRUIT/CULTURAL/apripruning.html?src=exchbt),Fire Blight...                    (URL: http://ipm.ucanr.edu/PMG/PESTNOTES/pn7414.html?src=exchbt),Training apple and pear trees...  (URL: http://ipm.ucanr.edu/PMG/GARDEN/FRUIT/CULTURAL/appletraining.html?src=exchbt),Asian Citrus Psyllid and Huang... (URL: http://ipm.ucanr.edu/QT/asiancitruscard.html?src=exchbt),"Bordeaux mixture - fungicide, ... (URL: http://ipm.ucanr.edu/TOOLS/PNAI/pnaishow.php?id=15?src=exchbt)","Cedar, cypress, and juniper ru... (URL: http://ipm.ucanr.edu/PMG/GARDEN/PLANTS/DISEASES/cedcyrust.html?src=exchbt)",Pruning peach and nectarine tr... (URL: http://ipm.ucanr.edu/PMG/GARDEN/FRUIT/CULTURAL/peachprune.html?src=exchbt)
17,"I bought a farm this year, and I'm learning about regenerative agriculture. Who can I contact about what are appropriate cover crops to grow for green manure, and what are sources for seed in the area?",Pruning your potatoes...          (URL: http://ipm.ucanr.edu/PMG/GARDEN/VEGES/CULTURAL/potpruning.html?src=exchbt),Field Bindweed...                 (URL: http://ipm.ucanr.edu/PMG/PESTNOTES/pn7462.html?src=exchbt),Powdery scab...                   (URL: http://ipm.ucanr.edu/PMG/GARDEN/VEGES/DISEASES/powderyscab.html?src=exchbt),Pumpkins...                       (URL: http://ipm.ucanr.edu/home-and-landscape/pumpkins/index.html?src=exchbt),Fertilizing your berries...       (URL: http://ipm.ucanr.edu/PMG/GARDEN/FRUIT/CULTURAL/blackberryfert.html?src=exchbt),Corn...                           (URL: http://ipm.ucanr.edu/home-and-landscape/corn/index.html?src=exchbt),Cantaloupe...                     (URL: http://ipm.ucanr.edu/home-and-landscape/cantaloupe/index.html?src=exchbt),Russian Thistle...                (URL: http://ipm.ucanr.edu/PMG/PESTNOTES/pn7486.html?src=exchbt),Planting cucurbits...             (URL: http://ipm.ucanr.edu/PMG/GARDEN/VEGES/CULTURAL/cantaloupeplant.html?src=exchbt),Verticillium wilt...              (URL: http://ipm.ucanr.edu/PMG/GARDEN/FRUIT/DISEASE/verticillwilt.html?src=exchbt)
18,"What cultivar would you recommend for a good table raspberry, red raspberry, that is firm and good for this area.",Raspberry horntail...             (URL: http://ipm.ucanr.edu/PMG/GARDEN/PLANTS/INVERT/raspberryhorntail.html?src=exchbt),Raspberry sawfly...               (URL: http://ipm.ucanr.edu/PMG/GARDEN/FRUIT/PESTS/raspsawfly.html?src=exchbt),Red sorrel...                     (URL: http://ipm.ucanr.edu/PMG/WEEDS/red_sorrel.html?src=exchbt),Strawberries...                   (URL: http://ipm.ucanr.edu/PMG/GARDEN/FRUIT/strawberries.html?src=exchbt),Mulberry...                       (URL: http://ipm.ucanr.edu/PMG/GARDEN/PLANTS/mulberry.html?src=exchbt),Elderberry...                     (URL: http://ipm.ucanr.edu/PMG/GARDEN/PLANTS/elderberry.html?src=exchbt),Cherry crinkle...                 (URL: http://ipm.ucanr.edu/PMG/GARDEN/FRUIT/ENVIRON/cherrycrinkle.html?src=exchbt),Blackberries and Raspberries...   (URL: http://ipm.ucanr.edu/PMG/GARDEN/FRUIT/blackberries.html?src=exchbt),Raspberry crown borer:...         (URL: http://ipm.ucanr.edu/PMG/GARDEN/FRUIT/PESTS/rascrownbor.html?src=exchbt),Pruning strawberries...           (URL: http://ipm.ucanr.edu/PMG/GARDEN/FRUIT/CULTURAL/strawberrypruning.html?src=exchbt)
20,Do you know an affordable source to get evergreen trees we can plant for a windbreak? We would like a windbreak for our house yard.,Chinese pistache...               (URL: http://ipm.ucanr.edu/PMG/GARDEN/PLANTS/chinesepistache.html?src=exchbt),Laurel...                         (URL: http://ipm.ucanr.edu/PMG/GARDEN/PLANTS/englishlaurel.html?src=exchbt),"Maidenhair tree, Ginkgo...        (URL: http://ipm.ucanr.edu/PMG/GARDEN/PLANTS/maidenhair.html?src=exchbt)",Escallonia...                     (URL: http://ipm.ucanr.edu/PMG/GARDEN/PLANTS/escallonia.html?src=exchbt),Cryptomeria...                    (URL: http://ipm.ucanr.edu/PMG/GARDEN/PLANTS/cryptomeria.html?src=exchbt),Maple...                          (URL: http://ipm.ucanr.edu/PMG/GARDEN/PLANTS/maple.html?src=exchbt),Rose...                           (URL: http://ipm.ucanr.edu/PMG/GARDEN/PLANTS/rose.html?src=exchbt),Australian willow...              (URL: http://ipm.ucanr.edu/PMG/GARDEN/PLANTS/auswillow.html?src=exchbt),Tree Borers...                    (URL: http://ipm.ucanr.edu/QT/treeborerscard.html?src=exchbt),Oak...                            (URL: http://ipm.ucanr.edu/PMG/GARDEN/PLANTS/oak.html?src=exchbt)
21,"We have two raised beds and want to add some additional soil to them this spring. What do you recommend? Is garden mulch a good choice? Also, what nutrients should we add to the soil before planting?",Planting...                       (URL: http://ipm.ucanr.edu/PMG/GARDEN/FRUIT/ENVIRON/strawplanting.html?src=exchbt),Planting...                       (URL: http://ipm.ucanr.edu/PMG/GARDEN/FRUIT/ENVIRON/graplant.html?src=exchbt),Planting...                       (URL: http://ipm.ucanr.edu/PMG/GARDEN/FRUIT/ENVIRON/fruitnutplanting.html?src=exchbt),Planting...                       (URL: http://ipm.ucanr.edu/PMG/GARDEN/VEGES/ENVIRON/planting.html?src=exchbt),Planting...                       (URL: http://ipm.ucanr.edu/PMG/GARDEN/VEGES/ENVIRON/carrotplanting.html?src=exchbt),Planting...                       (URL: http://ipm.ucanr.edu/PMG/GARDEN/FRUIT/ENVIRON/avoplanting.html?src=exchbt),Planting...                       (URL: http://ipm.ucanr.edu/PMG/GARDEN/VEGES/ENVIRON/crnplanting.html?src=exchbt),Planting...                       (URL: http://ipm.ucanr.edu/PMG/GARDEN/VEGES/ENVIRON/potplanting.html?src=exchbt),Planting cucurbits...             (URL: http://ipm.ucanr.edu/PMG/GARDEN/VEGES/CULTURAL/cantaloupeplant.html?src=exchbt),Planting caneberries...           (URL: http://ipm.ucanr.edu/PMG/GARDEN/FRUIT/CULTURAL/blackberryplantinh.html?src=exchbt)
22,"I have a few apple trees. The one has a bent over growth form (no apical dominant stem), and has multiple suckers. It is also stunted compared to neighboring trees.  Do you know what this could be related to?",Pepper tree (California pepper... (URL: http://ipm.ucanr.edu/PMG/GARDEN/PLANTS/peppertree.html?src=exchbt),"Maidenhair tree, Ginkgo...        (URL: http://ipm.ucanr.edu/PMG/GARDEN/PLANTS/maidenhair.html?src=exchbt)",Pruning apple and pear trees...   (URL: http://ipm.ucanr.edu/PMG/GARDEN/FRUIT/CULTURAL/applepruning.html?src=exchbt),First-year pruning for fruit a... (URL: http://ipm.ucanr.edu/PMG/GARDEN/FRUIT/CULTURAL/almondfirst.html?src=exchbt),Fir...                            (URL: http://ipm.ucanr.edu/PMG/GARDEN/PLANTS/fir.html?src=exchbt),"Cedar, cypress, and juniper ru... (URL: http://ipm.ucanr.edu/PMG/GARDEN/PLANTS/DISEASES/cedcyrust.html?src=exchbt)",Katsura tree...                   (URL: http://ipm.ucanr.edu/PMG/GARDEN/PLANTS/katsura.html?src=exchbt),Bermudagrass...                   (URL: http://ipm.ucanr.edu/PMG/PESTNOTES/pn7453.html?src=exchbt),"Araucaria, Bunya-Bunya tree, M... (URL: http://ipm.ucanr.edu/PMG/GARDEN/PLANTS/araucaria.html?src=exchbt)",Erythrina Stem Borer...           (URL: https://www2.ipm.ucanr.edu/Invasive-and-Exotic-Pests/Erythrina-stem-borer/?src=exchbt)
23,Have we had our last frost for spring of 2022? I'm trying to figure out when to plant.,Planting...                       (URL: http://ipm.ucanr.edu/PMG/GARDEN/FRUIT/ENVIRON/strawplanting.html?src=exchbt),Planting...                       (URL: http://ipm.ucanr.edu/PMG/GARDEN/FRUIT/ENVIRON/graplant.html?src=exchbt),Planting...                       (URL: http://ipm.ucanr.edu/PMG/GARDEN/FRUIT/ENVIRON/fruitnutplanting.html?src=exchbt),Planting...                       (URL: http://ipm.ucanr.edu/PMG/GARDEN/VEGES/ENVIRON/planting.html?src=exchbt),Planting...                       (URL: http://ipm.ucanr.edu/PMG/GARDEN/VEGES/ENVIRON/carrotplanting.html?src=exchbt),Planting...                       (URL: http://ipm.ucanr.edu/PMG/GARDEN/FRUIT/ENVIRON/avoplanting.html?src=exchbt),Planting...                       (URL: http://ipm.ucanr.edu/PMG/GARDEN/VEGES/ENVIRON/crnplanting.html?src=exchbt),Planting...                       (URL: http://ipm.ucanr.edu/PMG/GARDEN/VEGES/ENVIRON/potplanting.html?src=exchbt),Plant properly...                 (URL: http://ipm.ucanr.edu/PMG/GARDEN/ENVIRON/plantproperly.html?src=exchbt),Seedlings...                      (URL: http://ipm.ucanr.edu/PMG/WEEDS/ID/broadseed.html?src=exchbt)
